<!--
  * bic21qualifiers.dtd
  *
  * Copyright (c) 2013-2015 Simon Fraser University Library
  * Copyright (c) 2000-2015 John Willinsky
  * Distributed under the GNU GPL v2. For full terms see the file docs/COPYING.
  *
  * DTD for BIC 2.1 Subject Qualifier lists.
  *
  -->
<!ELEMENT qualifiers (qualifier+)>
<!ELEMENT qualifier EMPTY>
	<!ATTLIST qualifier 
		code CDATA #REQUIRED
		text CDATA #REQUIRED>
